{
  "schema_version": "source-discovery-request-v1",
  "request_id": "sdrq_01ARZ3NDEKTSV4RRFFQ69G5FAV",
  "organization_id": "org_01ARZ3NDEKTSV4RRFFQ69G5FAV",
  "actor_principal_id": "usr_01ARZ3NDEKTSV4RRFFQ69G5FAV",
  "connection_id": "conn_01ARZ3NDEKTSV4RRFFQ69G5FAV",
  "connection_revision": 1,
  "trust_profile_hash": "sha256:1111111111111111111111111111111111111111111111111111111111111111",
  "security_epoch": 3,
  "max_views": 1024,
  "max_columns": 256,
  "max_comment_bytes": 65536,
  "statement_timeout_ms": 300000,
  "transaction_timeout_ms": 600000,
  "idempotency_key_hash": "sha256:3333333333333333333333333333333333333333333333333333333333333333",
  "issued_at": "2026-09-09T10:00:00Z",
  "expires_at": "2026-09-09T10:15:00Z"
}
